topic_id,auto_name,top_words,manual_name
0,mom_dad_house,"mom, dad, house, family, brother, said, like, year, home, told, take, time, mother, one, day",
1,said_told_back,"said, told, back, one, car, police, time, name, court, hospital, called, call, anything, day, since",
2,house_car_year,"house, car, year, loan, home, mortgage, pay, work, parent, job, school, time, month, make, debt",
3,year_child_mother,"year, child, mother, lawyer, time, house, help, money, court, legal, attorney, need, back, family, make",
4,like_time_sex,"like, time, sex, love, relationship, year, make, thing, together, even, life, say, way, much, lot",
5,like_dog_time,"like, dog, time, one, work, thing, people, told, day, said, say, something, need, much, make",
6,lease_apartment_rent,"lease, apartment, rent, landlord, month, day, pay, tenant, move, time, year, moved, new, notice, one",
7,time_like_year,"time, like, year, even, thing, make, told, need, said, help, day, always, month, never, much",
8,like_friend_said,"like, friend, said, time, thing, relationship, told, year, day, one, even, never, guy, back, month",
9,credit_card_pay,"credit, card, pay, insurance, month, payment, loan, year, bill, paid, account, debt, one, score, time",
10,work_time_job,"work, time, job, hour, home, like, day, week, one, year, even, school, say, friend, since",
11,year_money_account,"year, money, account, tax, month, pay, like, saving, fund, make, much, payment, need, bank, income",
12,company_work_week,"company, work, week, job, time, back, insurance, year, one, car, pay, day, told, need, new",
